{
  "capabilities": [
    "entity_security_identity_v1",
    "standard_observation_v1",
    "score_v1"
  ],
  "contract_versions": {
    "answer_schema": "1.0.0",
    "identity_schema": "2.2.0",
    "model_policy_schema": "2.0.0",
    "observation_schema": "1.1.0",
    "question_catalog": "3.2.0"
  },
  "observation_context": {
    "answer_schema_sha256": "cefa301b35235c15f188bfede2706837ea695e10b656a28684eecd0159434fcd",
    "identity_snapshot_sha256": "bbbbbbbbbbbbbbbbbbbbbbbbbbbbbbbbbbbbbbbbbbbbbbbbbbbbbbbbbbbbbbbb",
    "manifest_content_sha256": "b525e300b20d74f7443e4fecbef8bddec83c144a2576fbad7eda012201245182",
    "manifest_file_sha256": "a7e80a5bcaf2cb2499fa24f091b129d7e1a2ebbf6e91a5666359c5e91c90270c",
    "metric_registry_sha256": "1513f03214ebb41ae5f079997ff9d7358afb0195c1191a39a92806b26042b01b",
    "observation_schema_sha256": "ab547ecdd81ee1b302aaef30941fb20ac1563b9122267f8858bcb91f8f2d34e0",
    "questions": {
      "CROSS_BORDER_01": {
        "frozen_prompt_sha256": "90ecd7d088f2dd51cbc87ad8a282201a5f9d23ef5cf340081cfe3de419d02a89",
        "metadata": {
          "cohort": {
            "company_type": "operating",
            "industries": [
              "industrial"
            ],
            "stage": "mature",
            "subtype": null
          },
          "comparison_group_id": "fixture-group",
          "construct_id": null,
          "cycle_sensitive": true,
          "entity_id": "ENT_CONTEXT_FIXTURE",
          "evidence_review_status": "unreviewed",
          "field_id": "score.cross_border_01",
          "information_cutoff": "2026-09-22",
          "inputset_id": "fixture-input",
          "method_id": "module-locked-v1/core-constructs-v1/bf16a908fdc40d6f/ad002842c9ce0630",
          "module_package_id": "pkg_24f07923f23cf0a2be5d7fb4b36a11925c779a8f4a68bdc9c81457084ded080f",
          "module_release_id": "modrel_18c097b26b82746d3b48d9f2da4858a15ce216bce39c2572d10c2dcef23d32b9",
          "question_definition_sha256": "a4f42065aa6b5dae3880aad128eb3ec8776509398ca8baeb345228ebede93389",
          "question_id": "CROSS_BORDER_01",
          "question_semantic_sha256": "ad002842c9ce063020a5110e434f8d3e90be02800df8ff8fe0df55acb43fafa5",
          "question_version": "1.0.0",
          "run_id": "fixture-run",
          "scan_id": "fixture-scan",
          "schema_version": "1.1.0",
          "scope": "entity",
          "security_id": null,
          "segment_id": null,
          "task_mode": "comparison",
          "template_version": "3.2.0"
        },
        "work_prompt_sha256": "90ecd7d088f2dd51cbc87ad8a282201a5f9d23ef5cf340081cfe3de419d02a89"
      },
      "CYCLICAL_01": {
        "frozen_prompt_sha256": "1052b862f2232d21313163e65a82f5edb65f7de8480aa652c779148b696aa05d",
        "metadata": {
          "cohort": {
            "company_type": "operating",
            "industries": [
              "industrial"
            ],
            "stage": "mature",
            "subtype": null
          },
          "comparison_group_id": "fixture-group",
          "construct_id": null,
          "cycle_sensitive": true,
          "entity_id": "ENT_CONTEXT_FIXTURE",
          "evidence_review_status": "unreviewed",
          "field_id": "score.cyclical_01",
          "information_cutoff": "2026-09-22",
          "inputset_id": "fixture-input",
          "method_id": "module-locked-v1/core-constructs-v1/bf16a908fdc40d6f/c90d6e66174d8854",
          "module_package_id": "pkg_24f07923f23cf0a2be5d7fb4b36a11925c779a8f4a68bdc9c81457084ded080f",
          "module_release_id": "modrel_18c097b26b82746d3b48d9f2da4858a15ce216bce39c2572d10c2dcef23d32b9",
          "question_definition_sha256": "39eaff48729b13e42d16166cddbeff138ba076bd3a24f17e9475248873136726",
          "question_id": "CYCLICAL_01",
          "question_semantic_sha256": "c90d6e66174d8854e2beaa7dd3667abef005ec904021062a5209168ea4a2eaca",
          "question_version": "1.0.0",
          "run_id": "fixture-run",
          "scan_id": "fixture-scan",
          "schema_version": "1.1.0",
          "scope": "entity",
          "security_id": null,
          "segment_id": null,
          "task_mode": "comparison",
          "template_version": "3.2.0"
        },
        "work_prompt_sha256": "1052b862f2232d21313163e65a82f5edb65f7de8480aa652c779148b696aa05d"
      },
      "CYCLICAL_02": {
        "frozen_prompt_sha256": "4773cb5d6183926928c82565fa2d1e59bc6ab7c56733cdc49e4a060db837602c",
        "metadata": {
          "cohort": {
            "company_type": "operating",
            "industries": [
              "industrial"
            ],
            "stage": "mature",
            "subtype": null
          },
          "comparison_group_id": "fixture-group",
          "construct_id": null,
          "cycle_sensitive": true,
          "entity_id": "ENT_CONTEXT_FIXTURE",
          "evidence_review_status": "unreviewed",
          "field_id": "score.cyclical_02",
          "information_cutoff": "2026-09-22",
          "inputset_id": "fixture-input",
          "method_id": "module-locked-v1/core-constructs-v1/bf16a908fdc40d6f/7713d5d347911d02",
          "module_package_id": "pkg_24f07923f23cf0a2be5d7fb4b36a11925c779a8f4a68bdc9c81457084ded080f",
          "module_release_id": "modrel_18c097b26b82746d3b48d9f2da4858a15ce216bce39c2572d10c2dcef23d32b9",
          "question_definition_sha256": "f86dbc9bab6dbb196b1d43d6cdb07e81d6749ead382b2dcb5eb81d245e701b17",
          "question_id": "CYCLICAL_02",
          "question_semantic_sha256": "7713d5d347911d023259360035b8311b920c49dbdbad4fb375b94dc3515dea87",
          "question_version": "1.0.0",
          "run_id": "fixture-run",
          "scan_id": "fixture-scan",
          "schema_version": "1.1.0",
          "scope": "entity",
          "security_id": null,
          "segment_id": null,
          "task_mode": "comparison",
          "template_version": "3.2.0"
        },
        "work_prompt_sha256": "4773cb5d6183926928c82565fa2d1e59bc6ab7c56733cdc49e4a060db837602c"
      },
      "INDUSTRIAL_01": {
        "frozen_prompt_sha256": "039c52559cf79f009a0fdf9459cc14ad485c66f774f750efcedaf940b210d6ce",
        "metadata": {
          "cohort": {
            "company_type": "operating",
            "industries": [
              "industrial"
            ],
            "stage": "mature",
            "subtype": null
          },
          "comparison_group_id": "fixture-group",
          "construct_id": null,
          "cycle_sensitive": true,
          "entity_id": "ENT_CONTEXT_FIXTURE",
          "evidence_review_status": "unreviewed",
          "field_id": "score.industrial_01",
          "information_cutoff": "2026-09-22",
          "inputset_id": "fixture-input",
          "method_id": "module-locked-v1/core-constructs-v1/bf16a908fdc40d6f/fa56bc5d614e7ed9",
          "module_package_id": "pkg_24f07923f23cf0a2be5d7fb4b36a11925c779a8f4a68bdc9c81457084ded080f",
          "module_release_id": "modrel_18c097b26b82746d3b48d9f2da4858a15ce216bce39c2572d10c2dcef23d32b9",
          "question_definition_sha256": "c2427e2f5f56c7ae7407d0edac4b47f43bb157d358b1eff46553c35b21a2aceb",
          "question_id": "INDUSTRIAL_01",
          "question_semantic_sha256": "fa56bc5d614e7ed95025a5e3d0bc7136ef9aa176054f78178bab1ce66c1323c8",
          "question_version": "1.0.0",
          "run_id": "fixture-run",
          "scan_id": "fixture-scan",
          "schema_version": "1.1.0",
          "scope": "entity",
          "security_id": null,
          "segment_id": null,
          "task_mode": "comparison",
          "template_version": "3.2.0"
        },
        "work_prompt_sha256": "039c52559cf79f009a0fdf9459cc14ad485c66f774f750efcedaf940b210d6ce"
      },
      "INDUSTRIAL_02": {
        "frozen_prompt_sha256": "c19c40816bd10056bf9b989d9e36168a6301aefa028331b34cc356c3f20018d0",
        "metadata": {
          "cohort": {
            "company_type": "operating",
            "industries": [
              "industrial"
            ],
            "stage": "mature",
            "subtype": null
          },
          "comparison_group_id": "fixture-group",
          "construct_id": null,
          "cycle_sensitive": true,
          "entity_id": "ENT_CONTEXT_FIXTURE",
          "evidence_review_status": "unreviewed",
          "field_id": "score.industrial_02",
          "information_cutoff": "2026-09-22",
          "inputset_id": "fixture-input",
          "method_id": "module-locked-v1/core-constructs-v1/bf16a908fdc40d6f/b5e179a2d54a6721",
          "module_package_id": "pkg_24f07923f23cf0a2be5d7fb4b36a11925c779a8f4a68bdc9c81457084ded080f",
          "module_release_id": "modrel_18c097b26b82746d3b48d9f2da4858a15ce216bce39c2572d10c2dcef23d32b9",
          "question_definition_sha256": "e571b55e6ebe1eccbcfa9a0c22a2cc3498a91cf0e64a64d88c0cb252f13e1d51",
          "question_id": "INDUSTRIAL_02",
          "question_semantic_sha256": "b5e179a2d54a6721cdba16e70966aa2758073ce621d72941bb0c5f2ea0c5efa2",
          "question_version": "1.0.0",
          "run_id": "fixture-run",
          "scan_id": "fixture-scan",
          "schema_version": "1.1.0",
          "scope": "entity",
          "security_id": null,
          "segment_id": null,
          "task_mode": "comparison",
          "template_version": "3.2.0"
        },
        "work_prompt_sha256": "c19c40816bd10056bf9b989d9e36168a6301aefa028331b34cc356c3f20018d0"
      },
      "IQS_01": {
        "frozen_prompt_sha256": "e283816b9c55f6417c464f84d9cc0a9585a7483d64ead488a30ac73cba61fb31",
        "metadata": {
          "cohort": {
            "company_type": "operating",
            "industries": [
              "industrial"
            ],
            "stage": "mature",
            "subtype": null
          },
          "comparison_group_id": "fixture-group",
          "construct_id": "IQS_01",
          "cycle_sensitive": true,
          "entity_id": "ENT_CONTEXT_FIXTURE",
          "evidence_review_status": "unreviewed",
          "field_id": "score.iqs_01",